{
  "version": 2,
  "article": "Modder入门学习/CSharp基础/新人路由导航.md",
  "entry": "entry",
  "nodes": [
    {
      "id": "entry",
      "type": "decision",
      "dimension": "C",
      "fallback": "c_standard",
      "map": {
        "0": "remedial",
        "1": "c_standard",
        "2": "c_fast"
      }
    },
    {
      "id": "c_standard",
      "type": "decision",
      "dimension": "T",
      "fallback": "standard",
      "map": {
        "0": "remedial",
        "1": "standard",
        "2": "deep"
      }
    },
    {
      "id": "c_fast",
      "type": "decision",
      "dimension": "T",
      "fallback": "fast",
      "map": {
        "0": "standard",
        "1": "fast",
        "2": "deep"
      }
    },
    {
      "id": "remedial",
      "type": "path",
      "path": "remedial"
    },
    {
      "id": "standard",
      "type": "path",
      "path": "standard"
    },
    {
      "id": "fast",
      "type": "path",
      "path": "fast"
    },
    {
      "id": "deep",
      "type": "path",
      "path": "deep"
    }
  ]
}
